TEXTO,PRECIO,FOTO-src
Chaqueta acolchada con capucha básica,"18,00€",https://cdn.media.amplience.net/i/primark/991068773528_01
Chaqueta acolchada con capucha básica,"18,00€",https://cdn.media.amplience.net/i/primark/991068773804_01
Cazadora bómber con capucha,"18,00€",https://cdn.media.amplience.net/i/primark/991070551528_01
Cazadora bómber con capucha,"18,00€",https://cdn.media.amplience.net/i/primark/991070551804_01
Cazadora bómber con capucha,"18,00€",https://cdn.media.amplience.net/i/primark/991070551416_01
Chaqueta universitaria de los Chicago Bulls de la NBA,"60,00€",https://cdn.media.amplience.net/i/primark/991082446804_01
Chaleco acolchado con cremallera,"15,00€",https://cdn.media.amplience.net/i/primark/991068748804_01
Chaqueta con forro de piel de borrego sintética,"35,00€",https://cdn.media.amplience.net/i/primark/991079740416_01
Cazadora con capucha,"18,00€",https://cdn.media.amplience.net/i/primark/991079759352_01
Chaqueta bómber acolchada geométrica,"30,00€",https://cdn.media.amplience.net/i/primark/991071327616_01
Chaqueta bómber acolchada geométrica,"30,00€",https://cdn.media.amplience.net/i/primark/991071327704_01
Chaqueta acolchada de cuello chimenea Essential,"18,00€",https://cdn.media.amplience.net/i/primark/991068821716_01
Cazadora con capucha,"18,00€",https://cdn.media.amplience.net/i/primark/991079759414_01
Chaqueta de sarga de The Stronghold,"25,00€",https://cdn.media.amplience.net/i/primark/991088957528_01
Parka con capucha y ribete de pelo sintético,"55,00€",https://cdn.media.amplience.net/i/primark/991080048804_01
Chaqueta de chándal con bloques de color,"22,00€",https://cdn.media.amplience.net/i/primark/991088262980_01
Chubasquero básico con capucha,"27,00€",https://cdn.media.amplience.net/i/primark/991076413804_01
Abrigo impermeable bicolor,"27,00€",https://cdn.media.amplience.net/i/primark/991070604415_01
Chaqueta acolchada híbrida,"30,00€",https://cdn.media.amplience.net/i/primark/991070867704_01
Chubasquero básico con capucha,"27,00€",https://cdn.media.amplience.net/i/primark/991088184804_01
Parka acolchada,"55,00€",https://cdn.media.amplience.net/i/primark/991080078706_01
Chaqueta de chándal UFC,"30,00€",https://cdn.media.amplience.net/i/primark/991094683804_01
Parka con capucha y ribete de pelo sintético,"55,00€",https://cdn.media.amplience.net/i/primark/991080048528_01
Chaleco bómber acolchado,"25,00€",https://cdn.media.amplience.net/i/primark/991070617804_01
Chaleco acolchado ligero,"15,00€",https://cdn.media.amplience.net/i/primark/991088086804_01
Chaleco acolchado liso,"25,00€",https://cdn.media.amplience.net/i/primark/991079545706_01
Chaqueta con capucha y revestimiento suave,"35,00€",https://cdn.media.amplience.net/i/primark/991088151112_01
Chaqueta vaquera «trucker»,"22,00€",https://cdn.media.amplience.net/i/primark/991088302804_01
Chaqueta vaquera «trucker»,"22,00€",https://cdn.media.amplience.net/i/primark/991088302504_01
Chaleco acolchado,"22,00€",https://cdn.media.amplience.net/i/primark/991088563804_01
Chaqueta acolchada con capucha,"18,00€",https://cdn.media.amplience.net/i/primark/991088041414_01
Chaleco acolchado ligero,"15,00€",https://cdn.media.amplience.net/i/primark/991088086112_01
Chaqueta de chándal bicolor,"18,00€",https://cdn.media.amplience.net/i/primark/991088152706_01
Chaqueta con capucha y revestimiento suave,"35,00€",https://cdn.media.amplience.net/i/primark/991088151528_01
Chaqueta de chándal bicolor co escudo,"20,00€",https://cdn.media.amplience.net/i/primark/991088161414_01
Chaleco acolchado,"22,00€",https://cdn.media.amplience.net/i/primark/991088563704_01
Chaqueta de chándal bicolor co escudo,"20,00€",https://cdn.media.amplience.net/i/primark/991088161612_01
Chaleco acolchado ligero,"15,00€",https://cdn.media.amplience.net/i/primark/991088086504_01